{
  "meta": {
    "updatedAt": "2026-06-24T06:00:03.689Z",
    "updatedBy": "cloud",
    "sources": [
      "espn.com",
      "fifa.com",
      "france24.com",
      "franceinfo",
      "fwctimes.com",
      "lequipe",
      "matchcalendar.football",
      "openfootball/worldcup.json",
      "ouest-france.fr",
      "skysports.com"
    ],
    "tournament": {
      "start": "2026-06-11",
      "end": "2026-07-19",
      "timezone": "Europe/Paris"
    }
  },
  "teams": [
    {
      "code": "MEX",
      "name": "Mexique",
      "flagIso": "mx",
      "group": "A"
    },
    {
      "code": "KOR",
      "name": "Corée du Sud",
      "flagIso": "kr",
      "group": "A"
    },
    {
      "code": "RSA",
      "name": "Afrique du Sud",
      "flagIso": "za",
      "group": "A"
    },
    {
      "code": "CZE",
      "name": "République tchèque",
      "flagIso": "cz",
      "group": "A"
    },
    {
      "code": "CAN",
      "name": "Canada",
      "flagIso": "ca",
      "group": "B"
    },
    {
      "code": "BIH",
      "name": "Bosnie-Herzégovine",
      "flagIso": "ba",
      "group": "B"
    },
    {
      "code": "SUI",
      "name": "Suisse",
      "flagIso": "ch",
      "group": "B"
    },
    {
      "code": "QAT",
      "name": "Qatar",
      "flagIso": "qa",
      "group": "B"
    },
    {
      "code": "BRA",
      "name": "Brésil",
      "flagIso": "br",
      "group": "C"
    },
    {
      "code": "MAR",
      "name": "Maroc",
      "flagIso": "ma",
      "group": "C"
    },
    {
      "code": "SCO",
      "name": "Écosse",
      "flagIso": "gb-sct",
      "group": "C"
    },
    {
      "code": "HTI",
      "name": "Haïti",
      "flagIso": "ht",
      "group": "C"
    },
    {
      "code": "USA",
      "name": "États-Unis",
      "flagIso": "us",
      "group": "D"
    },
    {
      "code": "AUS",
      "name": "Australie",
      "flagIso": "au",
      "group": "D"
    },
    {
      "code": "PAR",
      "name": "Paraguay",
      "flagIso": "py",
      "group": "D"
    },
    {
      "code": "TUR",
      "name": "Turquie",
      "flagIso": "tr",
      "group": "D"
    },
    {
      "code": "GER",
      "name": "Allemagne",
      "flagIso": "de",
      "group": "E"
    },
    {
      "code": "ECU",
      "name": "Équateur",
      "flagIso": "ec",
      "group": "E"
    },
    {
      "code": "CIV",
      "name": "Côte d'Ivoire",
      "flagIso": "ci",
      "group": "E"
    },
    {
      "code": "CUW",
      "name": "Curaçao",
      "flagIso": "cw",
      "group": "E"
    },
    {
      "code": "NED",
      "name": "Pays-Bas",
      "flagIso": "nl",
      "group": "F"
    },
    {
      "code": "JPN",
      "name": "Japon",
      "flagIso": "jp",
      "group": "F"
    },
    {
      "code": "TUN",
      "name": "Tunisie",
      "flagIso": "tn",
      "group": "F"
    },
    {
      "code": "SWE",
      "name": "Suède",
      "flagIso": "se",
      "group": "F"
    },
    {
      "code": "BEL",
      "name": "Belgique",
      "flagIso": "be",
      "group": "G"
    },
    {
      "code": "IRN",
      "name": "Iran",
      "flagIso": "ir",
      "group": "G"
    },
    {
      "code": "EGY",
      "name": "Égypte",
      "flagIso": "eg",
      "group": "G"
    },
    {
      "code": "NZL",
      "name": "Nouvelle-Zélande",
      "flagIso": "nz",
      "group": "G"
    },
    {
      "code": "ESP",
      "name": "Espagne",
      "flagIso": "es",
      "group": "H"
    },
    {
      "code": "URU",
      "name": "Uruguay",
      "flagIso": "uy",
      "group": "H"
    },
    {
      "code": "KSA",
      "name": "Arabie saoudite",
      "flagIso": "sa",
      "group": "H"
    },
    {
      "code": "CPV",
      "name": "Cap-Vert",
      "flagIso": "cv",
      "group": "H"
    },
    {
      "code": "FRA",
      "name": "France",
      "flagIso": "fr",
      "group": "I"
    },
    {
      "code": "SEN",
      "name": "Sénégal",
      "flagIso": "sn",
      "group": "I"
    },
    {
      "code": "NOR",
      "name": "Norvège",
      "flagIso": "no",
      "group": "I"
    },
    {
      "code": "IRQ",
      "name": "Irak",
      "flagIso": "iq",
      "group": "I"
    },
    {
      "code": "ARG",
      "name": "Argentine",
      "flagIso": "ar",
      "group": "J"
    },
    {
      "code": "AUT",
      "name": "Autriche",
      "flagIso": "at",
      "group": "J"
    },
    {
      "code": "ALG",
      "name": "Algérie",
      "flagIso": "dz",
      "group": "J"
    },
    {
      "code": "JOR",
      "name": "Jordanie",
      "flagIso": "jo",
      "group": "J"
    },
    {
      "code": "POR",
      "name": "Portugal",
      "flagIso": "pt",
      "group": "K"
    },
    {
      "code": "COL",
      "name": "Colombie",
      "flagIso": "co",
      "group": "K"
    },
    {
      "code": "UZB",
      "name": "Ouzbékistan",
      "flagIso": "uz",
      "group": "K"
    },
    {
      "code": "COD",
      "name": "RD Congo",
      "flagIso": "cd",
      "group": "K"
    },
    {
      "code": "ENG",
      "name": "Angleterre",
      "flagIso": "gb-eng",
      "group": "L"
    },
    {
      "code": "CRO",
      "name": "Croatie",
      "flagIso": "hr",
      "group": "L"
    },
    {
      "code": "PAN",
      "name": "Panama",
      "flagIso": "pa",
      "group": "L"
    },
    {
      "code": "GHA",
      "name": "Ghana",
      "flagIso": "gh",
      "group": "L"
    }
  ],
  "groups": [
    {
      "id": "A",
      "teams": [
        "MEX",
        "KOR",
        "RSA",
        "CZE"
      ],
      "standings": [
        {
          "team": "MEX",
          "played": 2,
          "won": 2,
          "drawn": 0,
          "lost": 0,
          "gf": 3,
          "ga": 0,
          "pts": 6
        },
        {
          "team": "KOR",
          "played": 2,
          "won": 1,
          "drawn": 0,
          "lost": 1,
          "gf": 2,
          "ga": 2,
          "pts": 3
        },
        {
          "team": "CZE",
          "played": 2,
          "won": 0,
          "drawn": 1,
          "lost": 1,
          "gf": 2,
          "ga": 3,
          "pts": 1
        },
        {
          "team": "RSA",
          "played": 2,
          "won": 0,
          "drawn": 1,
          "lost": 1,
          "gf": 1,
          "ga": 3,
          "pts": 1
        }
      ]
    },
    {
      "id": "B",
      "teams": [
        "CAN",
        "BIH",
        "SUI",
        "QAT"
      ],
      "standings": [
        {
          "team": "CAN",
          "played": 2,
          "won": 1,
          "drawn": 1,
          "lost": 0,
          "gf": 7,
          "ga": 1,
          "pts": 4
        },
        {
          "team": "SUI",
          "played": 2,
          "won": 1,
          "drawn": 1,
          "lost": 0,
          "gf": 5,
          "ga": 2,
          "pts": 4
        },
        {
          "team": "BIH",
          "played": 2,
          "won": 0,
          "drawn": 1,
          "lost": 1,
          "gf": 2,
          "ga": 5,
          "pts": 1
        },
        {
          "team": "QAT",
          "played": 2,
          "won": 0,
          "drawn": 1,
          "lost": 1,
          "gf": 1,
          "ga": 7,
          "pts": 1
        }
      ]
    },
    {
      "id": "C",
      "teams": [
        "BRA",
        "MAR",
        "SCO",
        "HTI"
      ],
      "standings": [
        {
          "team": "BRA",
          "played": 2,
          "won": 1,
          "drawn": 1,
          "lost": 0,
          "gf": 4,
          "ga": 1,
          "pts": 4
        },
        {
          "team": "MAR",
          "played": 2,
          "won": 1,
          "drawn": 1,
          "lost": 0,
          "gf": 2,
          "ga": 1,
          "pts": 4
        },
        {
          "team": "SCO",
          "played": 2,
          "won": 1,
          "drawn": 0,
          "lost": 1,
          "gf": 1,
          "ga": 1,
          "pts": 3
        },
        {
          "team": "HTI",
          "played": 2,
          "won": 0,
          "drawn": 0,
          "lost": 2,
          "gf": 0,
          "ga": 4,
          "pts": 0
        }
      ]
    },
    {
      "id": "D",
      "teams": [
        "USA",
        "PAR",
        "AUS",
        "TUR"
      ],
      "standings": [
        {
          "team": "USA",
          "played": 2,
          "won": 2,
          "drawn": 0,
          "lost": 0,
          "gf": 6,
          "ga": 1,
          "pts": 6
        },
        {
          "team": "AUS",
          "played": 2,
          "won": 1,
          "drawn": 0,
          "lost": 1,
          "gf": 2,
          "ga": 2,
          "pts": 3
        },
        {
          "team": "PAR",
          "played": 2,
          "won": 1,
          "drawn": 0,
          "lost": 1,
          "gf": 2,
          "ga": 4,
          "pts": 3
        },
        {
          "team": "TUR",
          "played": 2,
          "won": 0,
          "drawn": 0,
          "lost": 2,
          "gf": 0,
          "ga": 3,
          "pts": 0
        }
      ]
    },
    {
      "id": "E",
      "teams": [
        "GER",
        "ECU",
        "CIV",
        "CUW"
      ],
      "standings": [
        {
          "team": "GER",
          "played": 2,
          "won": 2,
          "drawn": 0,
          "lost": 0,
          "gf": 9,
          "ga": 2,
          "pts": 6
        },
        {
          "team": "CIV",
          "played": 2,
          "won": 1,
          "drawn": 0,
          "lost": 1,
          "gf": 2,
          "ga": 2,
          "pts": 3
        },
        {
          "team": "ECU",
          "played": 2,
          "won": 0,
          "drawn": 1,
          "lost": 1,
          "gf": 0,
          "ga": 1,
          "pts": 1
        },
        {
          "team": "CUW",
          "played": 2,
          "won": 0,
          "drawn": 1,
          "lost": 1,
          "gf": 1,
          "ga": 7,
          "pts": 1
        }
      ]
    },
    {
      "id": "F",
      "teams": [
        "NED",
        "JPN",
        "SWE",
        "TUN"